glottocode,LANGUAGE,FAMILY,MARKER,GLOSS,STATUS,AFFIXED_TO,NEG_SCOPING_OVER,AFFIX_SCOPING_OVER_NEG,EXAMPLE,GLOSS,TRANSLATION,COMMENT,REFERENCE,TYPE_OF_REFERENCE,PAGE,PAGE_EXTRA,,,
ship1254,Shipibo-Konibo,Pano-Tacanan,-yama,NEG,suffix,,PL ,,Ja-baon-ra e-a a-kan-an-yama-ke,3-PL:ERG-EV 1-ABS do.T-PL-MAL-NEG-CMPL,They did not do (it) on me,,Valenzuela (2003) ,Grammar,724,,,,
ship1254,Shipibo-Konibo,Pano-Tacanan,-ma ,NEG,suffix,,PL ,,Shipibo-ra kapé pi-kan-ai-bo-ma iki,Shipibo:ABS-EV alligator eat-PL-PP1-PL-NEG COP,The Shipibo don’t eat alligator (lit. The Shipibo are not alligator-eaters,-kan is retained under nominalization,Valenzuela (2003) ,Grammar,437,,,,
ship1254,Shipibo-Konibo,Pano-Tacanan,-ma ,NEG,suffix,,RECP,,Neno-ra tso-a-bi tima-anan-a-ma iki. ,Here-EV who-ABS-EM hit.w/fist-REC-PP2-NEG AUX,Here nobody has hit each other,,Valenzuela (2003) ,Grammar,807,,,,
ship1254,Shipibo-Konibo,Pano-Tacanan,-ma ,NEG,suffix,,TRNZ,,"...joni mawá-ke-tian miin-kati-kan-ai yoxan-baon ak-á maweta meran, raka-n-a-ma",person:ABS die-P-DS bury-PST4-PL-INC old.woman-PL:ERG do-T-PP2 big.jar inside lying.position-TRNZ-PP2-NEG,"..when a person died (s)he was buried in a big jar which the elderly women had made, the dead was seated straight inside the big jar, (s)he was not laid.",,Valenzuela (2003) ,Grammar,260,,,,
ship1254,Shipibo-Konibo,Pano-Tacanan,-yama,NEG,suffix,,VBZ,,ja axa-n-kan-ke-bi joni ka-yama-a iki jawen awin too-ya i-ke-tian, jawen awin too-ya i-xon yapa pae-n-ma-yama-na-ke-tian,that poison-TRNZ-PL-PDS-EM man:ABS go-NEG-PP2 AUX POS3 wife.ABS round-PROP be-P-DS POS3 wife:ABS round-PROP be-PSSA fish:ABS sour-VBLZ-CAUS-NEG-PREV-P-DS,"Although the people of the village were fishing with barbasco (fish poison), the man did not go because his wife was pregnant; fearing that being pregnant his wife would prevent the fish from getting poisoned",,Valenzuela (2003) ,Grammar,293,,,
yami1256,Yaminahua ,Pano-Tacanan,yama,NEG,suffix,,,IPFV,Ka-yama-fe,Go-NEG-IPFV,Don’t go [No vayas],,Loos & Faust (2002),Grammar,41,,,,
yami1256,Yaminahua ,Pano-Tacanan,ka,NEG.DES,suffix,,,PL,Kirika tapĩ-kaspa-ka-nĩ,book know-NEG.DES-PL-EVID,They don’t want to study (lit. Know) [Ellos no quieren saber],Negative desiderative,Loos & Faust (2002),Grammar,29,,,,
yami1256,Yaminahua ,Pano-Tacanan,yama,NEG,suffix,,,PL,Me-yama-kã-fe,Touch-NEG-PL-IPFV,Don’t touch him! (1SG.PL > 3SG) [No lo toquen],,Loos & Faust (2002),Grammar,127,,,,
yami1256,Yaminahua ,Pano-Tacanan,kaspa,NEG,suffix,,,PROG,Exto ka-kaspa-i,little.brother go-DES.NEG-PROG,The little broder does not want to go [El hermanito no quiere ir],,Loos & Faust (2002),Grammar,128,,,,
yami1256,Yaminahua ,Pano-Tacanan,ma ,NEG,suffix,,COMPL,,¿Tsoa kirika fi-a-ma-mẽ,who:ERG book receive-COMP-NEG-INTERR,Who didn’t receive a book? [¿Quién no recibió un libro?],,Loos & Faust (2002),Grammar,66,,,,
yami1256,Yaminahua ,Pano-Tacanan,ma ,NEG,suffix,,DES,,Ě xea-pai-ma,1SG eat-DES-(prog)-NEG,I don’t want to eat (papaya) [No quiero comer (papaya),Answering a question,Loos & Faust (2002),Grammar,36,,,,
yami1256,Yaminahua ,Pano-Tacanan,ma ,NEG,suffix,,FUT,,anã nõ ano-ax sete-nã-naka-ma,again 1SG.PL LOC-partap fight-RECIP-PROG.FUT-NEG,We are not going to fight there [Ya no pelearemos allá],,Loos & Faust (2002),Grammar,123,,,,
yami1256,Yaminahua ,Pano-Tacanan,ma ,NEG,suffix,,PL ,,Efẽ fake fo-ita-fo-ma,my son go-PST(YESTERDAY)-PL-NEG,My sons didn’t go yesterday [Mis hijos no fueron ayer],,Loos & Faust (2002),Grammar,120,,,,
yami1256,Yaminahua ,Pano-Tacanan,ma ,NEG,suffix,,POT,,"ẽ fepe-tiro-ma, na fepo-ti fepo-a",1sg open-POT-NEG this close-NOM close-PART-(COMP),I can’t open the closed door [No puedo abrir la puerta cerrada],,Loos & Faust (2002),Grammar,71,,,,
yami1256,Yaminahua ,Pano-Tacanan,ma ,NEG,suffix,,PROG,,"maa, ẽ ka-i-ma",No 1sg go-PROG-NEG,"No, I’m not going [No, no me voy]",,Loos & Faust (2002),Grammar,36,,,,
yami1256,Yaminahua ,Pano-Tacanan,ma ,NEG,suffix,,PST,,"Ẽ-tio o-ni-ma, pishta ẽ o-ni.",My-size come-REM.PST-NEG small 1SG come-REM.PST,"I didn’t came big, I was a child when I came (lit. I didn’t came with the size I am now) [No vine del tamaño que soy ahora",,Loos & Faust (2002),Grammar,57,,,,
yami1256,Yaminahua ,Pano-Tacanan,ma ,NEG,suffix,,RECP,,anã nõ ano-ax sete-nã-naka-ma,again 1pl LOC-PARTAP fight-RECIP-FUT.PROG-NEG,We will not fight there (Spa. Ya no pelearemos allá),,Loos & Faust (2002),Grammar,123,,,,
yora1241,Yora,Pano-Tacanan,-yamã,NEG,suffix,v,,EXH,A-ki afa i-yamã-nõ,3SG-ABLOC something do.ITR-NEG-EXH,So that nothing happens to him,,Lord (2016),Grammar Sketch,113,,,,
yora1241,Yora,Pano-Tacanan,-yamã,NEG,suffix,v,,IMP ,mee-pai-rifa-yamã-fe,Sense-DES-IT.ITR-NEG-IMP,Don’t keep trying to touch it,,Lord (2016),Grammar Sketch,81,,,,
yora1241,Yora,Pano-Tacanan,-yamã,NEG,suffix,v,,IPFV,nokofene noi-yama-i chai-koĩ ferotame-pao-ni-fo,man.ABS like-NEG-IMPF.SS.GVI far-RL suspended.hammock-HAB-PST1-PL,"If they didn’t like a man [who was interested in them], [women] suspended their hammocks way up high",,Lord (2016),Grammar Sketch,83,,,,
yora1241,Yora,Pano-Tacanan,-ma,NEG,suffix,v,,PERSU,“na chaka-fãfẽ tsoa iyo-chaka-tiro-fo-ma-i na-fãfẽ” ẽ fa-yamea,DEM.VIS bad-PL.ERG someone.ABS transport.MAS.HUM-DIS-POT-PL-NEG-PER DEM-VIS-PL.ERG 1SG.NOM say-PST2,"“these wicked guys don’t transport anyone, they [don’t], so do what I imply. How wicked of them” I said","PER = Persuation marker, if there is no explicit command, it is rendered in free translation as “so do what I imply”",Lord (2016),Grammar Sketch,42,,,,
yora1241,Yora,Pano-Tacanan,-yamã,NEG,suffix,v,,POT,Tene-yama-tiro-xa-kĩ askafa-tiro,Endure-NEG-POT-IVL-IPFV scold-POT,"[A bad person] scolds [others], having had the habit of not enduring [things]",,Lord (2016),Grammar Sketch,89,,,,
yora1241,Yora,Pano-Tacanan,-ma,NEG,suffix,v,ATTIME,,Ĩ afa fa-yo-fãfain-a-ma kaya-xo-ma,1SG.NOM something.ABS make-ATT-IT.TR-PRF-NEG get.well-PRF-SS-GVT-NEG,"at first I wasn’t making anything, not having gotten well","ATT = if the verb is not negated it means “do x action first”, if the verb is negated it means “yet” or “at first”",Lord (2016),Grammar Sketch,43,,,,
yora1241,Yora,Pano-Tacanan,-yamã,NEG,suffix,v,ATTIME,,faki ka-yo-yama-tã ĩ afa fa-tiro mee-i-ma-ki,where go-ATT-NEG-AP 1SG.NOM something.ABS make-POT sense-IPFV-NEG-PER,"i don’t feel that I can go anywhere yet or cook anything, so do what I imply","ATT = if the verb is not negated it means “do x action first”, if the verb is negated it means “yet” or “at first”",Lord (2016),Grammar Sketch,136,,,,
yora1241,Yora,Pano-Tacanan,-ma,NEG,suffix,v,DES,,atirifi pãxta noko keyo-pai-tiro-ma,some dog.ERG 1PL.ACC bite-DES-POT-NEG,Some dogs don’t want to bite us,,Lord (2016),Grammar Sketch,20,,,,
yora1241,Yora,Pano-Tacanan,-ma,NEG,suffix,v,DIS,,“na chaka-fãfẽ tsoa iyo-chaka-tiro-fo-ma-i na-fãfẽ” ẽ fa-yamea,DEM.VIS bad-PL.ERG someone.ABS transport.MAS.HUM-DIS-POT-PL-NEG-PER DEM-VIS-PL.ERG 1SG.NOM say-PST2,"“these wicked guys don’t transport anyone, they [don’t], so do what I imply. How wicked of them” I said",,Lord (2016),Grammar Sketch,42,,,,
yora1241,Yora,Pano-Tacanan,-ma,NEG,suffix,v,EXH,,A-ki afa i-nõ-ma,3SG-ABLOC something do.ITR-EXH-NEG,So that nothing happens to him,,Lord (2016),Grammar Sketch,113,,,,
yora1241,Yora,Pano-Tacanan,-ma,NEG,suffix,v,HAB,,E-res i-pao-ni-ma,1SG.NOM-alone do.ITR-HAB-PST1-NEG,Back then I didn’t dance by myself,,Lord (2016),Grammar Sketch,70,,,,
yora1241,Yora,Pano-Tacanan,-ma,NEG,suffix,v,IPFV,,sábado afa fa-pai-i-ma,saturday something.ABS do-DES-IMPF-NEG,[I] will not try to do anything Saturday,,Lord (2016),Grammar Sketch,62,,,,
yora1241,Yora,Pano-Tacanan,-ma,NEG,suffix,v,PFV,,A-to fi-a-ma. ,3sg-ERG obtain-PRF-NEG,He didn’t get one,,Lord (2016),Grammar Sketch,23,,,,
yora1241,Yora,Pano-Tacanan,-ma,NEG,suffix,v,PL,,“na chaka-fãfẽ tsoa iyo-chaka-tiro-fo-ma-i na-fãfẽ” ẽ fa-yamea,DEM.VIS bad-PL.ERG someone.ABS transport.MAS.HUM-DIS-POT-PL-NEG-PER DEM-VIS-PL.ERG 1SG.NOM say-PST2,"“these wicked guys don’t transport anyone, they [don’t], so do what I imply. How wicked of them” I said",,Lord (2016),Grammar Sketch,42,,,,
yora1241,Yora,Pano-Tacanan,-ma,NEG,suffix,v,POT,,ẽ nami chaka nika-fãĩn-i ka-tiro-ma,1SG.NOM meat bad.ABS hear-MAS.TR-IMPF go-POT-NEG,"On the other hand, I don’t go because of hearing about their old meat",,Lord (2016),Grammar Sketch,43,,,,
yora1241,Yora,Pano-Tacanan,-ma,NEG,suffix,v,PST,,nõko pachia iki-ita-ma,1PL.POSS bananas.ABS enter-PST3-NEG,Our babanas didn’t go in [the river],,Lord (2016),Grammar Sketch,45,,,,
yauy1235,Quechua (Yauyos),Quechuan,-chu ,NEG,enclitic,,ADD,,"unay ñuqa-kuna-qa mana-m qawa-rqa-ni-chu, pay-kuna-qa alminus mana-m qawa-rqa-pis-chu",before I-PL-TOP no-EVD see-PST-1-NEG 3PL-TOP at.least no-EVD see-PST-ADD-NEG,"Before, we didn’t see, but they, at least, didn’t see either",,Shimelman (2017) ,Grammar,37,,,,
yauy1235,Quechua (Yauyos),Quechuan,-chu ,NEG,enclitic,,CAUS,,Mayqin-ni-ki-pis mana yuya-chi-wa-rqa-nki-chu,which-EUPH-2-ADD no remember-CAUS-1.OBJ-PST-2-NEG,Neither of you reminded me,,Shimelman (2017) ,Grammar,50,,,,
yauy1235,Quechua (Yauyos),Quechuan,-chu ,NEG,enclitic,,COND,,Wanu-ku-n-man-tri-ki ima-na-n-man-taq imayna mana kuti-ka-mu-n-man-chu,die-REFL-3-COMP-EVC-KI what-VRBZ-3-COND-SEQ why no return-REFL-CISL-3-COND-NEG,"He could die, of course. What could hapen? Why can’t he come back? ",,Shimelman (2017) ,Grammar,55,,,,
yauy1235,Quechua (Yauyos),Quechuan,-chu ,NEG,enclitic,,OBJ,,Mayqin-ni-ki-pis mana yuya-chi-wa-rqa-nki-chu,which-EUPH-2-ADD no remember-CAUS-1.OBJ-PST-2-NEG,Neither of you reminded me,,Shimelman (2017) ,Grammar,50,,,,
yauy1235,Quechua (Yauyos),Quechuan,-chu ,NEG,enclitic,,PERSON,,Mana-m ñuqa-qa Viñaq-ta tiqsi-:-chu qam riqsi-nki-chu Min ,No-EVD I-TOP Viñac-ACC be.acquainted.with-1-NEG you be.acquainted.with-2Q Min,"I don’t know Viñac. Do you know it, Min? ",,Shimelman (2017) ,Grammar,37,,,,
yauy1235,Quechua (Yauyos),Quechuan,-chu,NEG,enclitic,,PST,,Mana-m ñuqa-kuna-qa talpu-la-:-chu pay-pa wawi-n-mi talpu-la,No-EVD 1-PL-TOP plant-PST-1-NEG he-3 baby-3-EVD plant-PST,We haven’t planted. Her children have planted.,,Shimelman (2017) ,Grammar,38,,,,
yauy1235,Quechua (Yauyos),Quechuan,-chu ,NEG,enclitic,,REFL,,Wanu-ku-n-man-tri-ki ima-na-n-man-taq imayna mana kuti-ka-mu-n-man-chu,die-REFL-3-COMP-EVC-KI what-VRBZ-3-COND-SEQ why no return-REFL-CISL-3-COND-NEG,"He could die, of course. What could hapen? Why can’t he come back? ",,Shimelman (2017) ,Grammar,55,,,,
arao1248,Araona,Pano-Tacanan,-pi...ma,NEG,circumfix,,,ITER,Pi-a-ibo-ma-isha,NEG1-make-PFV.N.VIS.N.VIS-NEG2-ITERAT,(We) do not do it any longer,Author calls it “circumclitics”,Emkow (2006),Thesis,480,,,,
arao1248,Araona,Pano-Tacanan,-pi...ma,NEG,circumfix,,CAUS,,tehe pi-soso-a-ma ake!,field NEG1-burn-CAUS-NEG2 AUX.TR-IMP,Don’t burn the field!,Author calls it “circumclitics”,Emkow (2006),Thesis,430,,,,
arao1248,Araona,Pano-Tacanan,-mawe,NEG,enclitic,,DES,,Ai-di-hae-mawe,Thing-eat-DES-NEG2,,Only with desiderative modal,Emkow (2006),Thesis,,,,,
arao1248,Araona,Pano-Tacanan,-mae ,NEG,suffix,,DES ,,Bāle aiyaha atsāwa-hae-mae,but someone.ERG help-DESID-NEG,but nobody wanted to help,,Emkow (2006),Thesis,278,,,,
arao1248,Araona,Pano-Tacanan,-pi...ma,NEG,circumfix,,DIR,,Pi-noa-ti-ma po-a,NEG1-return-DIR-NEG2 AUX-INTR-PAST.REC,(She/He) did not return (from the field),Author calls it “circumclitics”,Emkow (2006),Thesis,446,,,,
arao1248,Araona,Pano-Tacanan,-pi...ma,NEG,circumfix,,MID (Middle),,Pi-ani-hai-tana-ma-tsio watsi potsōtso,NEG1-sit-well-MIDDLE-NEG2-when foot fall.asleep,"When you do not sit well, your feet fall asleep",Author calls it “circumclitics”,Emkow (2006),Thesis,523,,,,
arao1248,Araona,Pano-Tacanan,-pi...ma,NEG,circumfix,,PFV,,hoda pi-papa-ibo-ma,3SG.ABS NEG1-burry-PFV.N.VIS-NEG2,(We) did not bury him (He was buried in Cochabamba),Author calls it “circumclitics”,Emkow (2006),Thesis,447,,,,
arao1248,Araona,Pano-Tacanan,-pi...ma,NEG,circumfix,,REFL,,...motoa-a e-nā-o pi-po-ti-ma,Caiman-ERG RL-water-LOC NEG1-po-REFL-NEG2 ,,Author calls it “circumclitics”,Emkow (2006),Thesis,171,,,,
arao1248,Araona,Pano-Tacanan,-pi...mawe,NEG,circumfix,,,,Pi-kwainya-mawe,NEG1-arrive-NEG,(She/He) has not arrived yet,meaning “not yet”,Emkow (2006),Thesis,445,,,,
esee1248,Ese Ejja,Pano-Tacanan,-xima,RES.NEG,suffix,,,ITER,"Pwaya ena dojo-majamaja-xima a-ka-ani, ",3ERG water take-ITER-RES.NEG do-3A-PRS,They do not take water every day,,Vuillermet (2012),Grammar,478,,,,
esee1248,Ese Ejja,Pano-Tacanan,-xima,RES.NEG,suffix,,,PERSON,"Eseja=ya xa-ba-ki-xima=se Ese Ejja=kwana pya, pya a-sawa-xi",1INCL.GEN=FOC MID-see-MID-RES.NEG=1INCL.ABS Ese Ejja=PL other other do-SOC-PURP,(Because) we Ese Ejja do not know yet to help other Ese Ejja (to do things),person clitic + absolutive case,Vuillermet (2012),Grammar,508,,,,
esee1248,Ese Ejja,Pano-Tacanan,a'a,NEG.IMP,particle,,,PERSON,A’a=mo kwya-xi!,IMP.NEG=1SG:ABS hit-IMP.NEG,Don’t hit me!,person clitic + absolutive case,Vuillermet (2012),Grammar,471,,,,
esee1248,Ese Ejja,Pano-Tacanan,-xi ,NEG.IMP,suffix,,CAUS,,A’a e-sho’i=kyana dobi-mee-xi!,IMP.NEG NPF-child=PL go.in-CAUS-IMP.NEG,Don’t let the children in! ,Imperative suffix,Vuillermet (2012),Grammar,470,,,,
esee1248,Ese Ejja,Pano-Tacanan,-'axa,NEG,suffix,,CAUS,,Kya-kawi-wiso=jo jama=tii akyana=kwana ani-mee-ka-poki-’axa,APF-night-many=LOC so=INTS thing=PL sit-CAUS-EXT.OBL-CONT.INTR-NEG,It is not possible to/one should not leave things like that for many days (lit. Many nights),EXT.OBL = external obligation ,Vuillermet (2012),Grammar,465,,,,
esee1248,Ese Ejja,Pano-Tacanan,-xima,RES.NEG,suffix,,DEPR,,Bishe dawa-pexa-jya-xima(…),canoe grill-hollow-DEPR-RES.NEG,(we did not come by water because) the canoe is not dug yet (lit.it is not grilled-hollow yet),resultative negator // DEPR=Depresiative,Vuillermet (2012),Grammar,407,,,,
esee1248,Ese Ejja,Pano-Tacanan,-'axa,NEG.IMP,suffix,,DEPR,,"Jama=ya e-wanase: a-ka-xi jama ba-maxe=ya, jama=tii kwya-jya-ka-’axa",so=FOC NPF-woman do-EXT.OBL-EXT.OBL so see-TMP.SS=FOC so=INTS hit-DEPR-EXT.OBL-NEG,"So (are) women. One has to act this way (i.e. hit them) when one sees them (with someone else), one should not hit them just like that (for no reason)",DEPR = Depresiative,Vuillermet (2012),Grammar,465,,,,
esee1248,Ese Ejja,Pano-Tacanan,-xi,RES.NEG,suffix,,go.to(.do),,"A’a akwi-kwi-jeyo=jo sowa-ki-xi, ‘oke-je!",IMP.NEG tree-plant-slippery=LOC go.up-go.to.do-IMP.NEG go.down-FUT,"Don’t go up on (this) splippery plant, you will fall down.",,Vuillermet (2012),Grammar,470,,,,
esee1248,Ese Ejja,Pano-Tacanan,-xima,RES.NEG,suffix,,MID (Middle),,"Eseja=ya xa-ba-ki-xima=se Ese Ejja=kwana pya, pya a-sawa-xi",1INCL.GEN=FOC MID-see-MID-RES.NEG=1INCL.ABS Ese Ejja=PL other other do-SOC-PURP,(Because) we Ese Ejja do not know yet to help other Ese Ejja (to do things),,Vuillermet (2012),Grammar,508,523,,,
esee1248,Ese Ejja,Pano-Tacanan,-xima,RES.NEG,suffix,,TEL,,Ekweya daki kya-chwe joka-’yo-xima,1SG.ERG clothes APF-wet dry-TEL-RES.NEG,"My clothes are (still) wet, not completely dry",,Vuillermet (2012),Grammar,571,,,,
bara1380,Barasano,Tucanoan,beti,NEG,suffix,,,COND,Yʉ-re ĩ ĩsi tʉo-beti-habã ĩ-re ẽ-ba-rʉʉkʉ-ha yʉ,1S-O 3ms give return.CAUS-NEG-COND 3ms-O take.from-DESIDms-3 1S,"If he doesn’t return that to me, I will take it from him",,Jones & Jones (1991),Book,126,,,,
bara1380,Barasano,Tucanoan,beti,NEG,suffix,,,IMP ,Yi-be-sa bʉ,Do-NEG-IMP-PROX 2s,Don’t do that!,,Jones & Jones (1991),Book,126,,,,
bara1380,Barasano,Tucanoan,beti,NEG,suffix,,,PERSON,wai bʉha-beti-ka-hʉ yʉa,fish find-NEG-far.past-3 1x,We didn’t find any fish,,Jones & Jones (1991),Book,125,,,,
bara1380,Barasano,Tucanoan,beti,NEG,suffix,,,PST,wai bʉha-beti-ka-hʉ yʉa,fish find-NEG-far.past-3 1x,We didn’t find any fish,,Jones & Jones (1991),Book,125,,,,
cara1272,Carapana,Tucanoan,-eti,NEG,suffix,v,,PERSON,Pa-eti-ya,Work-NEG-PRES.1,I do not work (orig: Yo no trabajo),all tense but PST and PROB.PRES,Metzger (1981) ,Grammar,63,,,,
desa1247,Desano,Tucanoan,bidi,NEG,suffix,,,EMPH,~ʉta-bu-ge-de wa-bidi-ta gʉya-~adi-ka,Stone-CLS:concave-LOC-REF go-NEG-EMPH be.dangerous-be-EVID:REAS,"Do not go by the rapids, it’s dangerous",,Silva (2012),Grammar,160,,,,
desa1247,Desano,Tucanoan,bidi,NEG,suffix,,,EVD,~bʉʉ pobe-bidi-ka,2SG be.fast-NEG-EVID:REAS,You are not fast,,Silva (2012),Grammar,97,,,,
desa1247,Desano,Tucanoan,be ,NEG,suffix,,,PERSON,ʉba-be-go,be.tall-NEG-3SG:FEM,She isn’t tall,,Silva (2012),Grammar,76,,,,
desa1247,Desano,Tucanoan,bidi,NEG,suffix,,,PERSON,Bʉku-bidi-go,be.happy-NEG-3SG:FEM,She is not happy,,Silva (2012),Grammar,76,,,,
desa1247,Desano,Tucanoan,be ,NEG,suffix,,,PRF,Yʉʉ ~bʉ’ʉ-de dode-be-a ~a’di-~yu-~bi,1SG 2SG-REF command-NEG-PERF say-EVID:QUOT/FOLK-3SG:M.IMPERF,"I don’t command you, he said",,Silva (2012),Grammar,81,,,,
desa1247,Desano,Tucanoan,bidi,NEG,suffix,,PRF,,~de ~oe-a-bidi-pʉ,NEG be.tired-PERF-NEG-3SG.M.PERF,(the tuiuiu bird flew) without tiring,,Silva (2012),Grammar,101,,,,
akun1241,Akuntsu,Tupian,nõm,NEG,particle,,PERSON (PREFIX),,nom i=at=om,no 3s=get=NEG,(you) don’t get it,,Aragon (2014),Grammar,233,298,,,
para1311,Guaraní,Tupian,nd...i,NEG,circumfix,,,already,Nd-a-japo-mo’ã-ve-i-ma pe-icha a-ñe-ñandu-vai=yre a-japo jave hína,NEG-1SG.act-make-NEG.FUT-more-NEG-already MED.SG-as 1SG-act-AGD-feel-bad=without 1SG.act-make while PROG,I will not do it like that anymore...without feeling bad while I do it,,Estigarribia (2020),Grammar,160,,,,
para1311,Guaraní,Tupian,nd...i,NEG,circumfix,,,EMPH,nd-a-jerovia-i=voi hese,NEG-1SG.act-believe-NEG=EMPH at.him/her,I do not believe him/her,,Estigarribia (2020),Grammar,159,,,,
para1311,Guaraní,Tupian,ani,NEG,particle,,,NEG.FUT,Ani-mo’ã-ke-na avave o-h-ekýi ndehegui ne-ñe’ĕ ,NEG-NEG.FUT-FORCE-REQ nobody 3.act-POSS3-take.away from.you.SG 2SG.inact-language,That/Let nobody ever take you language from you!,,Estigarribia (2020),Grammar,109,175,,,
para1311,Guaraní,Tupian,nd...i,NEG,circumfix,,,NMLZ,O-je-h-echa pe-va nda-ikatu-mo’ã-i-ha ,3.act-AGD-POSSM3-see MED.SG-ADJZ NEG-be.able-NEG.FUT-NEG-NMLZ,One can see that that is not possible,,Estigarribia (2020),Grammar,116,,,,
para1311,Guaraní,Tupian,nd...i,NEG,circumfix,,,PST,N-a-imo’ã-i-va’ekue re-juhu otro che-r-ekovia-rã ,NEG-1SG.act-think-NEG-PAST 2SG-act-find another 1SG.inact-POSSM-replacement-DEST,I didn’t think you would find another to replace me,,Estigarribia (2020),Grammar,162,,,,
para1311,Guaraní,Tupian,nd...i,NEG,circumfix,,CAUS,,che=rehe ne-re-ñe-mbo-h-ory-mo’ã-i,1SG.inact=at NEG-2SG.act-AGD-MAKE1-POSSM3-joy-NEG.FUT-NEG,You will not make fun of me,,Estigarribia (2020),Grammar,143,179,,,
para1311,Guaraní,Tupian,mo’ã,NEG,suffix,,NEG,,Ani-mo’ã-ke-na avave o-h-ekýi ndehegui ne-ñe’ĕ ,NEG-NEG.FUT-FORCE-REQ nobody 3.act-POSS3-take.away from.you.SG 2SG.inact-language,That/Let nobody ever take you language from you!,,Estigarribia (2020),Grammar,109,156,,,
para1311,Guaraní,Tupian,nd...i,NEG,circumfix,,NEG.FUT ,,Ha’e nd-o-iko-mo’ã-i-ha ,I.say NEG-3.ACT-be-NEG.FUT-NEG-NMLZ,I say that there will not be (one),,Estigarribia (2020),Grammar,71,115,,,
para1311,Guaraní,Tupian,nd...i,NEG,circumfix,,PERSON,,Nd-a-guata-se-ve-i,NEG-1SG.ACT-walk-want-more-NEG,I do not want to walk more,Active and Inactive Person,Estigarribia (2020),Grammar,37,116,,,
para1311,Guaraní,Tupian,-tei,NEG,suffix,,PERSON (IMP),,Ani ere-tei nd-a-reko-pa-i=ko hína,NEG-IMP IMP.2SG.act.say-NEG.IMP NEG-1SG.act-have-all=VERD PROG,Don’t say (that)…. I don’t have everything,Imperative suffix,Estigarribia (2020),Grammar,176,,,,
para1311,Guaraní,Tupian,ani,NEG,particle,,,,Ani e-japo pe-va,NEG.IMP IMP-make MED-SG-ADJZ,Don’t do that!,Imperative negative word,Estigarribia (2020),Grammar,75,,,,
coca1260,Kukama-Kukamilla,Tupian,tɨma,NEG,particle,,,FOC,tɨma=pura=ai na utsu ajan ɨpatsu=kuara,NEG=FOC=already 2SG go this lake=INE,You will never go to this lake,negative particle. Negates the whole clause or predicate,Vallejos (2016) ,Grammar,313,424-578,,,
coca1260,Kukama-Kukamilla,Tupian,ni(=),NEG,particle,,,FOC,aipuka ni=pura ɨwatsu emete,currently NEG=FOC paiche exist,"Nowadays, no paiche (type of fish) exists",,Vallejos (2016) ,Grammar,349,,,,
coca1260,Kukama-Kukamilla,Tupian,ni(=),NEG,particle,,,FUT ,tɨma t=ikua-ta ni=awa=utsu,NEG 1SG.MS=know-CAU NEG=person=FUT1,I won’t tell anyone,,Vallejos (2016) ,Grammar,101,427,,,
coca1260,Kukama-Kukamilla,Tupian,tɨma,NEG,particle,,,MODAL,tɨma=rai emete ɨkɨ,NEG=SPE exist chili ,There wouldn’t be any chili [Indirect request: ‘Maybe you have some chili’],SPE= Speculative modality,Vallejos (2016) ,Grammar,350,422,,,
coca1260,Kukama-Kukamilla,Tupian,tɨma,NEG,particle,,,MODAL,tɨma=tika ini waina=pura cada yatsɨ ini tsuwɨ=pura ini itika,NEG=CER2 1PL.IN woman=FOC each moon 1PL.IN blood=FOC 1PL.IN throw,"Isn’t it true we, women, each month we throw our blood?",CER2= Certainty modality,Vallejos (2016) ,Grammar,405,406,,,
coca1260,Kukama-Kukamilla,Tupian,ni(=),NEG,particle,,,MODAL,ni=rai r=yakuarara ikian ra pe=tsuriai ,NEG=SPE 2SG.MS=remember this 3SG.MS way=PAS3,It seems he didn´t remember his way,SPE= Speculative modality,Vallejos (2016) ,Grammar,407,,,,
coca1260,Kukama-Kukamilla,Tupian,ni(=),NEG,particle,,,MODAL,na etse=taka ni=ukirɨ=mia tapɨa uka=kuara,like.this 1SG.FS=UNC NEG=sleep=HYP indian house=INE,"So, maybe I wouldn’t be able to sleep in an Indian’s house",HYP= Hypothetical modality (after stem),Vallejos (2016) ,Grammar,422,,,,
coca1260,Kukama-Kukamilla,Tupian,ni(=),NEG,particle,,,OBJ,ni=ra=purara=tana,NEG=3SG.MS=find=1PL.IN ,He doesn’t find us ,,Vallejos (2016) ,Grammar,62,,,,
coca1260,Kukama-Kukamilla,Tupian,ni(=),NEG,particle,,,PERSON,ni=ra=purara=tana,NEG=3SG.MS=find=1PL.IN ,He doesn’t find us ,proclitic? To negate specific arguments,Vallejos (2016) ,Grammar,62,155-214-382,,,
tapi1253,Tapiete,Tupian,ä,NEG,suffix,,,FUT ,mba’e a-yapo-ä-po,thing 1SG.ACC-do-NEG-FUT,I won’t do anything,,Gonzáles (2005),Grammar,191,,,,
tapi1253,Tapiete,Tupian,ä,NEG,suffix,,,PL,Ma’entɨ-we-a-ma-reta kwa-we-a-ma ha’e wóka-re sanya’ɨ-re,Sow-NOM-NEG-RES-PL know-NOM-NEG-RES 3.sg DEM-PL child-PL,"They don’t sow any more, now the children don’t know about those things",,Gonzáles (2005),Grammar,125,,,,
tapi1253,Tapiete,Tupian,ä,NEG,suffix,,,RES,Ma’entɨ-we-a-ma-reta kwa-we-a-ma ha’e wóka-re sanya’ɨ-re,Sow-NOM-NEG-RES-PL know-NOM-NEG-RES 3.sg DEM-PL child-PL,"They don’t sow any more, now the children don’t know about those things",RESULTATIVE ,Gonzáles (2005),Grammar,125,,,,
tapi1253,Tapiete,Tupian,ä,NEG,suffix,,IMP,,Mbɨ-sɨpe-ha-ä-ma,CAUS1-win-IMPER-NEG-RES,They haven’t won (to she/he) [no le han ganado],,Gonzáles (2005),Grammar,192,,,,
tapi1253,Tapiete,Tupian,ä,NEG,suffix,,NMLZ,,hama sanya’ɨ-re ä o-ho-wa-ré ñani-ñe’ë hä’ä-vea-rä,then child-PL now 3.ACC-go-NOM-PL our-language speak-NMLZ-NEG-SUB,"Then, today’s youngsters do not speak our language anymore",Might be a mistake in the glossa,Gonzáles (2005),Grammar,230,,,,
tapi1253,Tapiete,Tupian,ä,NEG,suffix,,NMLZ,,Ma’entɨ-we-a-ma-reta kwa-we-a-ma ha’e wóka-re sanya’ɨ-re,Sow-NOM-NEG-RES-PL know-NOM-NEG-RES 3.sg DEM-PL child-PL,"They don’t sow any more, now the children don’t know about those things",,Gonzáles (2005),Grammar,125,,,,
hual1241,Quechua (Huallaga),Quechuan,mana,NEG,particle,,,,mana rura-shka-:-chu,NEG do-PERF-1-NEG,I did not do it ,"mana may be omitted. However, in almost all cases it is present (when a main clause is negated)",Weber (1996),Grammar,335,,,,
hual1241,Quechua (Huallaga),Quechuan,-chu,NEG,suffix,,PERF,,mana rura-shka-:-chu,NEG do-PERF-1-NEG,I did not do it ,,Weber (1996),Grammar,335,,,,
hual1241,Quechua (Huallaga),Quechuan,-chu,NEG,suffix,,PERSON,,maya-shka-:-chu,sense-PERF-1-NEG,I didn’t hear it ,,Weber (1996),Grammar,335,,,,
hual1241,Quechua (Huallaga),Quechuan,-chu,NEG,suffix,,IMP,,ama upa ka-y-chu qam!,NEG fool be-2IMP-NEG you,Don’t be a fool!,,Weber (1996),Grammar,337,,,,
hual1241,Quechua (Huallaga),Quechuan,ama,NEG.IMP,particle,,,,ama upa ka-y-chu qam!,NEG fool be-2IMP-NEG you,Don’t be a fool!,,Weber (1996),Grammar,337,,,,
para1316,Paraujano (Añun),Arawakan,-pe,NEG,suffix,,PROSPEC.,,wa-yaapaa-ía-chi-pe,1PL-wait.for-PROSPECTIVE-M-NEG,We are not going to wait for him,Añun is the sole arawak language in which negation is expressed solely by a suffix. Example from Patte 1989,Michael (2014),Book,255,,,,
para1316,Paraujano (Añun),Arawakan,-pe,NEG,suffix,,DES,,a-una-ee ta-ein Marükai-mi a-ka a-una-ee-pe nü-ein te-imüchi,0-go-DES 1S-soul Maracaibo-towards 0-with 0-go-DES-NEG 3S-soul 1S-husband,"I want to go to Maracaibo, but my husband does not want to go (original: Yo quiero ir a Maracaibo pero mi esposo no quiere ir)",,Álvarez (2009),article,148,,,,
acha1250,Achagua,Arawakan,o-,NEG.IMP,preffix,,PERSON,,o-hi-íinu,IMP.NEG-2SG-come,Don’t come! (original: No vengas),,Wilson & Levinsohn (1992),Grammar Sketch,32,,,,
acha1250,Achagua,Arawakan,ho-,NEG,preffix,,,,nuyá hó-ka-i méda nu-núma yúuwika-u ,1SG NEG-AFIR-SG.MAS do 1SG-mouth fat-PS,I dont lie (original: no miento (lit. no me hago grasa la boca)),,Wilson & Levinsohn (1992),Grammar Sketch,8,,,,
yucu1253,Yucuna,Arawakan,unka,NEG,particle,,,,unka pi=amá-la-je o’wé,NEG 2SG=see-V.NEG-FUT brother,You will not see (my) brother,,Lemus Serrano (2020),Thesis,13,,,,
yucu1253,Yucuna,Arawakan,-la,NEG,suffix,,,FUT,unka pi=amá-la-je o’wé,NEG 2SG=see-V.NEG-FUT brother,You will not see (my) brother,,Lemus Serrano (2020),Thesis,13,,,,
