glottocode,LANGUAGE,FAMILY,MARKER,GLOSS,STATUS,AFFIXED_TO,NEG_SCOPING_OVER,AFFIX_SCOPING_OVER_NEG,EXAMPLE,GLOSS,TRANSLATION,COMMENT,REFERENCE,TYPE_OF_REFERENCE,PAGE,PAGE_EXTRA,,,
pume1238,Yaruro,Isolate (Yayuro) ,dè,NEG,suffix,"V,N",,,aore judi jura-dè-pẽã de,dog D3:Ms.SU eat-NEG-FINAL 3sM/0:0/M,The dog stopped eating [el perro dejó de comer],Own translation ,Guerreiro de Pirela (2015),Thesis,135,,,,
kana1291,Canamarí,Katukinan,tu,NEG,suffix,,,DUR,itsaroh hinuk bapo-tu-nim,woman PL finish-NEG-DUR,The women weren’t finished,Own translation from portuguese,Ishy (2018),Thesis,205,,,,
kana1291,Canamarí,Katukinan,tu,NEG,suffix,,,SUBR,itsaroh toyaik-tu-nim panim…,woman guard-NEG-SUBD já ,A woman who does not protect…,Own translation from portuguese. subd = subordinator,Ishy (2018),Thesis,132,,,,
kana1291,Canamarí,Katukinan,tu,NEG,suffix,,INTR,,adik nhama o-hu-k-tu ,1PL CONECTOR INDF-marry-INTRS-NEG,We were not marry with each other,Own translation from portuguese. INTRS = Intransitivisador,Ishy (2018),Thesis,111,,,,
kana1291,Canamarí,Katukinan,tu,NEG,suffix,,,,Katsatsa-hi i-nakibak-tu ,Cachaca-liquid 1SG-like-NEG,I don’t like cachaca (pl) ,Own translation from portuguese,Ishy (2018),Thesis,111,,,,
niva1238,Nivaclé,Matacoan,ni7-,NEG,prefix,v,,INTS,ka7 tem ni7-n-ȏ7=a7=shi yi-wȏm-jat pa-pu,IRR.CONJ HES NEG-3SUBO-cook=NEG=INTENS 3ACT-lose-CAUS REP-PL.HUM,"if they don’t cook it well, it will kill someone ",,"Campbell, Diaz & Angél (2020)",Grammar,270,,,,
niva1238,Nivaclé,Matacoan,a7,NEG,clitic,v,,INTS,ka7 tem ni7-n-ȏ7=a7=shi yi-wȏm-jat pa-pu,IRR.CONJ HES NEG-3SUBO-cook=NEG=INTENS 3ACT-lose-CAUS REP-PL.HUM,"if they don’t cook it well, it will kill someone ",,"Campbell, Diaz & Angél (2020)",Grammar,270,,,,
niva1238,Nivaclé,Matacoan,ni7-,NEG,prefix,v,,PL,ȏm=pa ka7 ni7-tuj=a=7e7elh,no=REP IRR.CONJ NEG-eat-NEG=PL.EXCL,There was nothing that we didn’t eat (we ate everything),,"Campbell, Diaz & Angél (2020)",Grammar,410,,,,
niva1238,Nivaclé,Matacoan,a7,NEG,clitic,v,,PL,ȏm=pa ka7 ni7-tuj=a=7e7elh,no=REP IRR.CONJ NEG-eat-NEG=PL.EXCL,There was nothing that we didn’t eat (we ate everything),,"Campbell, Diaz & Angél (2020)",Grammar,410,,,,
niva1238,Nivaclé,Matacoan,ni7-,NEG,prefix,v,,RECP,ni-7na-nkȏtsitay=wach,NEG-3STAT-hate=RECIP,they hate each other,,"Campbell, Diaz & Angél (2020)",Grammar,299,,,,
niva1238,Nivaclé,Matacoan,ni7-,NEG,prefix,v,VBZ,,Ih-junash nȏke7ey ni7-na-t-ch’an,3POS-like VIS.DEM NEG-3SUBO-VBLZ-obey,for example he did not obey him,,"Campbell, Diaz & Angél (2020)",Grammar,270,,,,
niva1238,Nivaclé,Matacoan,ya7aj,NEG.IMP,word,,,,ya7aj ka7 a-snatesh,NEG-IMP IRR.CONJ 2IMP-do,Don’t do that!,,"Campbell, Diaz & Angél (2020)",Grammar,384,,,,
wich1261,Wichi,Matacoan,ha...hi,,circumfix,,,APPL,Ha-la-chel-hi-n’u-hu,NEG.R-2SUB-answer-NEG.R-1OBJ-APL,You didn’t answer me,,Nercesian (2011),Thesis,412,,,,
wich1261,Wichi,Matacoan,-hi ,NEG,suffix,,,CONT,n’-y’en-hi-lhi n’-tefwlhache n’-n’oyij,1SUB-be.tired-NEG-CONT 1SUB-continue 1SUB-walk,"I am not tired, I will continue to walk",,Nercesian (2011),Thesis,212,,,,
wich1261,Wichi,Matacoan,ha...hi,,circumfix,,,DES,...ha-t’e-hi-nlo-k iwu+ch’efwa-ya…,NEG.R-3SUB:want-NEG.R-want-DES 3SUB:do+spouse-CI,(It) didn’t want her/him to get married,,Nercesian (2011),Thesis,355,,,,
wich1261,Wichi,Matacoan,ha...hi,,circumfix,,,DIM,akoj t’i ha-t’en-hi-fwaj t’i ,be.tasty liquid NEG.R-2SUB:be.hard-NEG.R-DIM liquid,The liquid is tasty and it is not so hard(dim) [refering to honey],,Nercesian (2011),Thesis,266,,,,
wich1261,Wichi,Matacoan,ha...hi,,circumfix,,,OBJ,Ha-la-chel-hi-n’u-hu,NEG.R-2SUB-answer-NEG.R-1OBJ-APL,You didn’t answer me,,Nercesian (2011),Thesis,412,,,,
wich1261,Wichi,Matacoan,ha...hi,,circumfix,,PERSON,,wit ha-’atha-hi n’-newhoche..,CONJ NEG.R-3SUB:be.easy-NEG.R 1SUB-get.close,and it is not easy to get near,,Nercesian (2011),Thesis,411,,,,
hupd1244,Hup,Naduhup,-nɨh ,NEG,suffix,,,DECL,"Cug’æt cuʔ-yóʔ, hɨʔ=teg cuʔ-yóʔ ní-mɨʔ, dóʔ=d’eh b’oy-ham-nɨh-ɨh",book grab-SEQ write=STRICK grab-SEQ be-under child-PL study-go-NEG-DECL,"Despide having grabbed books and pencils, the children did not go to study",,Epps (2008),Grammar,731,,,,
hupd1244,Hup,Naduhup,-nɨh ,NEG,suffix,,,EMPH,yɨ-d’ə̌h-ǎn peʔ-nɨh=pog bɨg=nih j’ám=hə́ʔ,That-ITG-PL-OBJ hurt-NEG=EMPH HAB=EMPH.CO DST.CNTR=INT.TAG,(It) never bothers/hurt them (discussing biting insects swarming on men without shirts) ,,Epps (2008),Grammar,735,,,,
hupd1244,Hup,Naduhup,-nɨh ,NEG,suffix,,,FOC,ʔám-ǎn d’oʔ-ʔũh-nɨh-áh ʔãh-ãp,2sg-OBJ take-APPL-NEG-FOC 1sg-DECL,I’m not going to get any (cookies) for you!,,Epps (2008),Grammar,733,,,,
hupd1244,Hup,Naduhup,-nɨh ,NEG,suffix,,,PL,Wɔh ʔɨd hipãh-nɨh=d’eh,River.Indian speech know-NEG=PL,Those who don’t know any Tukano,,Epps (2008),Grammar,728,,,,
hupd1244,Hup,Naduhup,-nɨh ,NEG,suffix,,,TEL,hũh-way-nɨh=yɨʔ níh!,Carry-go.out-NEG=TEL be.IMP,Don’t carry (him) out!,,Epps (2008),Grammar,727,,,,
hupd1244,Hup,Naduhup,-nɨh ,NEG,suffix,,APPL,,ʔám-ǎn d’oʔ-ʔũh-nɨh-áh ʔãh-ãp,2sg-OBJ take-APPL-NEG-FOC 1sg-DECL,I’m not going to get any (cookies) for you!,,Epps (2008),Grammar,733,,,,
amah1246,Amahuaca,Pano-Tacanan,yama,NEG,word,,,DECL,"maqui, yama-hnu","No, NEG-DECL","No, there is none",,Sparing-Chávez (2012),Grammar Sketch,44,,,,
amah1246,Amahuaca,Pano-Tacanan,-hi  ,NEG,suffix,v,,DECL,Joyaza-hi-hnu,Come-NEG-DECL,He has not arrived,,Sparing-Chávez (2012),Grammar Sketch,44,,,,
amah1246,Amahuaca,Pano-Tacanan,-yama,NEG,suffix,v,,FOC,"¿moha-ra min jira-hai? Maqui, jira-yama-mun-ax hun-hca-nu","Now-Q you eat-2PFTV.PST No, eat-NEG-FOC-PST I-ACT-DECL","Did you already eat? No, I have not (yet) eaten",,Sparing-Chávez (2012),Grammar Sketch,45,,,,
amah1246,Amahuaca,Pano-Tacanan,-yama,NEG,suffix,v,,FRUS,jaa hun racaata-hton hiin-yama-pana-hto-mun hun hain-nin hiya: “cazorina-ya aceite-mun chami-n vi-qui-hnu”,where I lie.down-REL.PRON see-NEG-FRUST-S/O-FOC my wife-ERG me gasoline-and oil-FOC younger.brother-ERG get-3IMM.PAST.PERF-DECL,"From where I was stretched out, I could not see (what was going on), so my wife said to me: “Younger brother has gotten gasoline and oil (to take to the hospital in town)”",,Sparing-Chávez (2012),Grammar Sketch,64,,,,
amah1246,Amahuaca,Pano-Tacanan,-yama,NEG,suffix,v,,PST,xau vuchi-pana-x-mun hun hovi hi-cain ca-yama-vahii-ha-hqui-nu,turtle look.for-FRUST-ABS-FOC me rain do-DS.NONSQ go-NEG-all.day-COMPL.PAST-ACT-DECL,I was going to look for a turtle but it rained and I did not go all day ,,Sparing-Chávez (2012),Grammar Sketch,63,,,,
amah1246,Amahuaca,Pano-Tacanan,-na,NEG,suffix,v,IMP,,Miya-x-qui nutuh-xanhquin-tzi min caivo jau paran-xanh-na pu,you-ACC-2/3ACT save-PURP(SS)TR-PERS.COMM your people something betray-IMP-NEG-M.VOC,(For heaven’s sake) don’t betray your people in order to save yourself,prohibitive context,Sparing-Chávez (2012),Grammar Sketch,53,,,,
amah1246,Amahuaca,Pano-Tacanan,-yama,NEG,suffix,v,REFL,,yantan horo-hax-mun jatzanamu-u-yama-shin-cu-hnu,late cultivate-SQ(SS)ITR-FO get.tired-REFL-NEG-1-3days.ago-1PST-DECL,"Cultivating till late yesterday, I didn’t get tired",,Sparing-Chávez (2012),Grammar Sketch,16,,,,
chac1251,Chacobo,Pano-Tacanan,yáma,NEG,enclitic,,,HORT ,ma ta-is=yáma=no ma-bɨ-Ɂoʂ=no i=Ɂiki’a,2pl ankle-see=NEG=HORT head-face-cover=HORT say=REP,"Don’t look him in the face, cover your face and head” he said",,Tallman (2018),Grammar,616,,,,
chac1251,Chacobo,Pano-Tacanan,yáma,NEG,enclitic,,,IPFV,TʃaɁita pi=y’ama=ʂo=wɨ i ki’a kako k’i ha-tó ɨwati=ní=kɨ,gra.fa eat=NEG=REMF=IMPER say REP caco DAT 3-PL:GEN gra.mo=REMP=DEC:P,Don’t eat your grandfather” his moter said to caco,,Tallman (2018),Grammar,533,,,,
chac1251,Chacobo,Pano-Tacanan,yáma,NEG,enclitic,,,NMLZ:IPV,Hɨnɨ tsi kía moɁi=y’ama=Ɂái=na,water p5 REP move=NEG=NMLZ:IPV=EPEN,The water didn’t mote (it is said) ,,Tallman (2018),Grammar,196,,,,
chac1251,Chacobo,Pano-Tacanan,yáma,NEG,enclitic,,,PASS,pi=yáma-Ɂaká=ki,eat=NEG-PASS=DEC:NONP,It (corn) will remain not eaten,,Tallman (2018),Grammar,633,,,,
chac1251,Chacobo,Pano-Tacanan,yáma,NEG,enclitic,,,PL,Tʃitʃ’ama a=y’ama=ka(n)=Ɂikiá yoʂa bo,container make=NEG=PL=REP woman PL,Women didn’t make containers [before] (it is said),,Tallman (2018),Grammar,221,,,,
chac1251,Chacobo,Pano-Tacanan,yáma,NEG,enclitic,,,REP,Tʃitʃ’ama a=y’ama=ka(n)=Ɂikiá yoʂa bo,container make=NEG=PL=REP woman PL,Women didn’t make containers [before] (it is said),,Tallman (2018),Grammar,221,,,,
chac1251,Chacobo,Pano-Tacanan,yáma,NEG,enclitic,,COMPL,,ka=yó=yáma=kɨ,go=CMPL=NEG=DEC:P,All of them did not go,Completive = PFV,Tallman (2018),Grammar,295,,,,
chac1251,Chacobo,Pano-Tacanan,yáma,NEG,enclitic,,HORT,,ʂawɨ=yá=ka ʂɨta=yá=ka awáʂo pi=no=ma rono,bone=COM=REL teeth=COM=REL wolf.fish eat=HORT=NEG anaconda,"One cannot eat anything with bones or with teeth, nor the wolf fish (because) it is a snake",,Tallman (2018),Grammar,246,,,,
chac1251,Chacobo,Pano-Tacanan,yáma,NEG,enclitic,,PASS,,tsók-a-Ɂaka=yáma nɨpáʂ=ka pistia tsaya=Ɂaí,loose-TR-PASS=NEG middle=REL small see=INTER:NONP:2SG,"But it (the fore-end of the rifle) did not fall out (lit. Was not pulled out), it was barely stuck in the middle, you see.",,Tallman (2018),Grammar,634,,,,
cash1251,Kashibo-Kakataibo,Pano-Tacanan,ma ,NEG,enclitic,"v, n",,CNTF,'ux-ax-ma-ri ‘i-ti=bi kana ‘ux-a-n,sleep-S/A>A-NEG-COUN be-NOM=same NAR.1sg sleep-PERF-1/2p,"I should not have slept, but I did",COUN =Counterfactual,Zariquiey 2011,Grammar,599,,,,
cash1251,Kashibo-Kakataibo,Pano-Tacanan,ma ,NEG,enclitic,"v, n",,go.to (-tan morpheme),ënë nami kana ‘ë=n pi-isa-ma-pain-tan-i-n,this meat.ABS NAR.1sg 1sg=A eat-IRRE-NEG-first-go.to-IMPF-1/2p,I have not eaten this meat yet,,Zariquiey 2011,Grammar,423,,,,
cash1251,Kashibo-Kakataibo,Pano-Tacanan,ma ,NEG,enclitic,"v, n",,IPFV,'ë=x kana ‘ux-i-ma-pan-i-n,1sg=S NAR.1sg sleep-IMPF-NEG-yet-IMPF-1/2,I have not slept yet,imperfective marker being repeated in this particular construction.,Zariquiey 2011,Grammar,532,,,,
cash1251,Kashibo-Kakataibo,Pano-Tacanan,ma ,NEG,enclitic,"v, n",,NMLZ,'unan-yama-kë ‘i-akë-x-a uinbi uinikë uni=n=bi,Know-NEG-NOM be-REM.PAST-3p-non.aprox nobody(A) no.one person=ERG=same,"It is said that, saying: “how does this man fish?”, the (other) men did not know, nobody, not one man knew",,Zariquiey 2011,Grammar,732,734,,,
cash1251,Kashibo-Kakataibo,Pano-Tacanan,ma ,NEG,enclitic,"v, n",,PERSON,'ë=x kana ‘ux-i-ma-pan-i-n,1sg=S NAR.1sg sleep-IMPF-NEG-yet-IMPF-1/2,I have not slept yet,imperfective marker being repeated in this particular construction.,Zariquiey 2011,Grammar,532,,,,
cash1251,Kashibo-Kakataibo,Pano-Tacanan,ma ,NEG,enclitic,"v, n",,PST,u-a=ma kaisa bari-kin=bi mëra-kas-ma-akë-x-ín,come-NOM=NEG NAR.REP.3p look.for-S/A>A(SE)-although find-DES-NEG-REM.PAST-3p-non.prox,"And, it is said that, although they were looking for (him), they could not find (him)",,Zariquiey 2011,Grammar,420,,,,
cash1251,Kashibo-Kakataibo,Pano-Tacanan,ma ,NEG,enclitic,"v, n",,SWITCH REFERENCE SUFFIXES,ënë nami kana ‘ë=n pi-isa-ma-pain-tan-i-n,this meat.ABS NAR-1sg 1sg=A eat-IRRE-NEG-first-go.to-IMPF-1/2p,I have not eaten this meat yet,,Zariquiey 2011,Grammar,423,,,,
cash1251,Kashibo-Kakataibo,Pano-Tacanan,ma ,NEG,enclitic,"v, n",DES,,u-a=ma kaisa bari-kin=bi mëra-kas-ma-akë-x-ín,come-NOM=NEG NAR.REP.3p look.for-S/A>A(SE)-although find-DES-NEG-REM.PAST-3p-non.prox,"And, it is said that, although they were looking for (him), they could not find (him)",,Zariquiey 2011,Grammar,420,,,,
cash1251,Kashibo-Kakataibo,Pano-Tacanan,ma ,NEG,enclitic,"v, n",IPFV,,'ë=n kana a bana ñui-ti kwëën-i=ma,1sg=A NAR.1sg that tale.ABS tell-NOM want-IMPF=NEG,I do not want to tell that tale,,Zariquiey 2011,Grammar,421,,,,
cash1251,Kashibo-Kakataibo,Pano-Tacanan,ma ,NEG,enclitic,"v, n",IRR,,'a-isa-ma-tan-kin kananuna ‘apat-i-n nónsi=birës,Do-IRRE-NEG-GO.TO-S/A>A(SE) NAR.1pl plant-IMPF-1/2p banana.ABS=purely,"Without wanting to do (something else), we plant purely banana",Irrealis marker with desiderative meaning,Zariquiey 2011,Grammar,423,,,,
cash1251,Kashibo-Kakataibo,Pano-Tacanan,ma ,NEG,enclitic,"v, n",NMLZ,,'ë=x kana ‘ux-kë=ma=pan ‘ain,1sg=S NAR.1sg sleep-NOM-NEG=yet be.1/2p,I had not slept yet,adverbial enclitic,Zariquiey 2011,Grammar,532,,,,
cash1251,Kashibo-Kakataibo,Pano-Tacanan,ma ,NEG,enclitic,"v, n",PL ,,anu kaisa ma a uni is-tëkën-kan-a=ma ‘ikën amiribishi ,there NAR.REP.3p already that person.ABS see-again-PLU-NOM=NEG be.3p again,They didn’t see that man any longer there,,Zariquiey 2011,Grammar,751,,,,
cash1251,Kashibo-Kakataibo,Pano-Tacanan,ma ,NEG,enclitic,"v, n",PST,,'inu=n rara a=n kaisa uni uni cha-bu ‘i-xun=bi=isa ain ainstsi kënu-ru-ia=bi kaisa uni-n kupi-a=ma ‘ikën,jaguar=GEN ancestor 3SG=A NAR.REP.3P man man big=PLU be-S/A>A-although=REP-3p their relative.ABS finish-almost.compl-A/S>O-although NAR.REP.3P man=ERG revenge-REM.PAST=NEG be.3s,"It is said that, although the ancestor of the jaguar was almost completely finishing off the people (even though they were very big), the people did not do anything and did not take revenge",,Zariquiey 2011,Grammar,402,,,,
cash1251,Kashibo-Kakataibo,Pano-Tacanan,ma ,NEG,enclitic,"v, n",SWITCH REFERENCE SUFFIXES,,pi-xun=ma ka ‘atan,"eat-S/A>A=NEG NAR TRAN.AUX-go,to.IMP",Don’t go to eat!,adverbial enclitic,Zariquiey 2011,Grammar,358,304,,,
mats1244,Matses,Pano-Tacanan,-en ,NEG,suffix,V,,AUG,Cho-en-quio-da ic-e-Ø,Come-NEG-AUG-UNCERT Aux-Npast-INTERR:1/2,Are you not coming? ,,Fleck 2003,Grammar,990,362,,,
mats1244,Matses,Pano-Tacanan,-a ,NEG.PERF,suffix,V,,EMPH,tsaodi ubi chui-a-bi cuen-ac que-onda-sh,I.dont.know 1.Abs tell-NEG.Perf-EMPH run.off-Infer say-Dist.Past-3,"“I dont know, he ran off without telling me”, he said. ",,Fleck 2003,Grammar,,408,,,
mats1244,Matses,Pano-Tacanan,-en ,NEG,suffix,V,,UNCERT,Cho-en-quio-da ic-e-Ø,Come-NEG-AUG-UNCERT Aux-Npast-INTERR:1/2,Are you not coming? ,,Fleck 2003,Grammar,990,,,,
mats1244,Matses,Pano-Tacanan,penquio,NEG,enclitic,"N, ADJ",,UNCERT,Në-mbo penquio-da ic-o-sh,Here-AUG NEG-UNCERT be-Past-3,Wasn’t it here? ,,Fleck 2003,Grammar,614,,,,
mats1244,Matses,Pano-Tacanan,penquio,NEG,enclitic,"N, ADJ",AGT.NZR,,abuc cani-quid-penquio schëcmaucudanmës ne-e-c,high grow-AGT.NZR-NEG palm.species be-Npast-INDIC,The schëcmaucudanmës palm does not grow tall ,Following N/NP,Fleck 2003,Grammar,718,,,,
mats1244,Matses,Pano-Tacanan,-enda,NEG.IMP,suffix,V,ANTIP,,Taë-n bed-ta se-me-an-enda que-quin,Foot-LOC grab-IMPER pierce-CAUS-ANTPASS-NEG.IMPER say-while:S/A>A,Grab his foot (in order to) not let him shoot me (with an arrow)! ,Imperative suffix. ANTIPASS = Antipassive,Fleck 2003,Grammar,,,,,
mats1244,Matses,Pano-Tacanan,-enda ,NEG.IMP,suffix,V,APPL,,aton iyua pe-me-shun-enda,3Gen pet eat-CAUS-APPL-Neg.IMPER,Don’t feed his pets/chickens for him,Imperative suffix,Fleck 2003,Grammar,351,,,,
mats1244,Matses,Pano-Tacanan,penquio,NEG,enclitic,"N, ADJ",AUG,,Nua-mbo-shë-penquio mencudu ic-e-c,Large-AUG-AUG-NEG naked.tailed.armadillo be-Npast-INDIC,Naked-tailed armadillos are not real big,Following Adjectives and Adverbs // “Negative morpheme (p 614),Fleck 2003,Grammar,614,,,,
mats1244,Matses,Pano-Tacanan,-enda,NEG.IMP,suffix,V,CAUS,,Nisi-Ø pe-me-enda ,Snake-Abs bite-CAUS-NEG.IMPER,Dont let a snake bite you!,Imperative suffix,Fleck 2003,Grammar,,332,,,
mats1244,Matses,Pano-Tacanan,-en,NEG,suffix,V,PASS,,umbi debi-Ø cues-ad-en-quio ic-o-sh,1Inst Davy-Abs hit-PASS-NEG-AUG Aux-Past-3 ,Davy didn’t let himself be hit by me,,Fleck 2003,Grammar,922,,,,
mats1244,Matses,Pano-Tacanan,-esa ,NEG.A.NMLZ,suffix,V,REFL,,Pinchuc-n më-se-ad-esa capa ne-e-c,Thorn-Inst hand-pierce-RFLX-NEG.A.Nzr squirrel be-Npast-INDIC,Amazon red squirrels are ones that dont poke themselves on their paws with the thorns [of the pinchuc palm]. ,A= transitive subject,Fleck 2003,Grammar,342,,,,
ship1254,Shipibo-Konibo,Pano-Tacanan,-yama,NEG,suffix,,,COMPL,Ja jawe-tian-bi joxo nawa-baon iamax oa ani joni-baon-bi no-a bichin-ti atipan-yama-ke,3:ABS what-TEMP-EM white outsider-PL:ERG or DIST big person-PL:ERG-EM 1p-ABS take.away.from-INF can-NEG-CMPL,Neither the mestizos nor any other powerful people can ever take it (our knowledge to make designs) away from us,Completive aspect,Valenzuela (2003) ,Grammar,252,146,,,
ship1254,Shipibo-Konibo,Pano-Tacanan,-yama,NEG,suffix,,,COMPL,E-a-ra e-n-bi-x-shaman beno-ama-[a] iki ,1-ABS-EV 1-NOM-EM-S-INTENS get.married-NEG-PP2 AUX ,I didn’t get married on my own will,PP2 (completive participle),Valenzuela (2003) ,Grammar,190,847,,,
ship1254,Shipibo-Konibo,Pano-Tacanan,-yama,NEG,suffix,,,DEPREC,"Titá, samá-yama-isi-we! ",mother:VOC fast-NEG-DEPREC-IMP,"Mother, don’t fast (to acquire special powers)!",DEPREC (deprecatory),Valenzuela (2003) ,Grammar,291,,,,
ship1254,Shipibo-Konibo,Pano-Tacanan,-yama,NEG,suffix,,,DIM,Anita-ma-shoko-tonin-ki,Small-NEG-DIM-LOC-HSY2,,adjetives? ,Valenzuela (2003) ,Grammar,144,,,,
ship1254,Shipibo-Konibo,Pano-Tacanan,-yama,NEG,suffix,,,DS ,"...mi-n jojó a-yama-[a]i-tian-ra e-n mi-a rao-n-ribi-ai, mecha ochíti ik-ai kaman!",2-ERG ONOM:bark do.T-NEG-S-DS-EV 1-ERG 2-ABS plant.medicine-TRNZ-REP-INC good.hunter dog do.I-PP1 until,"If you do not bark (at animals) I will treat you with plant medicine again, until you become a good-hunter dog. (talking to dog while curing it) ",,Valenzuela (2003) ,Grammar,363,293-727,,,
ship1254,Shipibo-Konibo,Pano-Tacanan,-yama,NEG,suffix,,,EMPH,"Ja waste-n i-xon ainbo-nin joni noko-a, keen-yama-pacho-kin-bi kikin a-kin noi ka-i",that piripiri-INST do.1-PSSA woman-ERG man:ABS meet-PO>S/A want-NEG-always-SSSA-EM extremely do.T-SSSA love:SSSI go:INC,"Making use of that piripiri, when the woman meets the man, even though he didn´t want her before, he is going to fall in love with her",,Valenzuela (2003) ,Grammar,428,559,,,
ship1254,Shipibo-Konibo,Pano-Tacanan,-ma ,NEG,suffix,,,EMPH,Yanka-biresa e-a bachimee-ke ikon-tani i-ke-n-ma-bi.,In-vain-purely:EV 1-ABS pull.by.the.hair:MID-CMPL true-ATT be-P-DS-NEG-EM,"I was pulled by the hair unfairly, without it being true (i.e. a woman thought I was having an affair with her husband and pulled me by the hair)",,Valenzuela (2003) ,Grammar,410,,,,
ship1254,Shipibo-Konibo,Pano-Tacanan,-yama,NEG,suffix,,,EVD,Toxbá-paké-yama-ra-kan-ai ,Float-going.down-NEG-EV-PL-INC,(They) do not go floating down the river,,Valenzuela (2003) ,Grammar,538,363,,,
ship1254,Shipibo-Konibo,Pano-Tacanan,-ma ,NEG,suffix,,,EVD,Yamet-a-ma-bi-ra jain oxa-ti bena-kan-ke,(become)night-PP2-NEG-EM-EV there sleep-INF look.for-PL-CMPL,"Before it became night, they looked for a place to sleep",,Valenzuela (2003) ,Grammar,496,,,,
ship1254,Shipibo-Konibo,Pano-Tacanan,-yama,NEG,suffix,,,FUT ,"Ne-ská-bi-ra mato ja-nonx iki: mato-n xeki bana-a-ra ishto-n i-ama-nonx iki, kimisha oxe-pari-ra mato i-nonx iki jawéki-a-kas-i manat-i.",PROX-SIML-EM-EV 2P:ABS exist-FUT 2P-ERG corn:ABS sow-PO>S/A-EV fast-ADVZ do.I-NEG-FUT three month-yet-EV 2P:ABS do.I-FUT food-do.T-DES-SSSS wait-SSSS,"You will live just like this: when cultivating corn it will not grow quickly, you will first have to wait three months in order to eat it. ",,Valenzuela (2003) ,Grammar,307,,,,
ship1254,Shipibo-Konibo,Pano-Tacanan,-yama,NEG,suffix,,,IMP ,"Titá, samá-yama-isi-we! ",mother:VOC fast-NEG-DEPREC-IMP,"Mother, don’t fast (to acquire special powers)!",,Valenzuela (2003) ,Grammar,291,186-398,,,
ship1254,Shipibo-Konibo,Pano-Tacanan,-yama,NEG,suffix,,,INCMPL,"E-n oin-a iki ja-ska-ra; icha baritia iki ja, ikaxbi e-a sihman-beno[t]-yama-[a]i",1-ERG see-PP2 AUX that-SMIL-ra much time COP that:ABS but 1-ABS mind/thinking-fail-NEG-INC,"That is what I saw; this happened a long time ago, but I don’t forget it",INC =  (incompletive aspect),Valenzuela (2003) ,Grammar,157,,,,
ship1254,Shipibo-Konibo,Pano-Tacanan,-kashama,NEG,suffix,,,INCMPL,Jawe kopi-ki mi-a ransa-kashama-[a]i? ,what reason/cause-INT 2-ABS dance-DES:NEG-PP1,,desiderative+negative. PP1 (incompletive participle)  ,Valenzuela (2003) ,Grammar,,458,,,
ship1254,Shipibo-Konibo,Pano-Tacanan,-yama,NEG,suffix,,,P ,"bakish oi be-yama-iba-ke-tian-ra, e-n moa pei bi-a i-kean-ke",one.day.away rain.ABS come.n.SG-NEG-PST2-P-DS-EV 1-ERG already leaf:ABS get-PP2 do.I-FRUST-CMPL,"If it had not rained yesterday, I would have gone to get palm leaf (for the roof)",Previous event,Valenzuela (2003) ,Grammar,501,,,,
ship1254,Shipibo-Konibo,Pano-Tacanan,-yama,NEG,suffix,,,PL,Oro-kin-yama-wan-kan-ke,clear.chacra-ASSOC-NEG-PST1-PL-CMPL,(They) did not help (her/him) clear the chacra earlier today,,Valenzuela (2003) ,Grammar,141,174-399-436-501-697,,,
ship1254,Shipibo-Konibo,Pano-Tacanan,-ma ,NEG,suffix,,,PL,Ja-ská-ke-tian-ronki ja washit-a-ma-bo ik-á iki: ,That-SIML-P-DS-HSY that deny-PP2-NEG-PL:ABS do.I-PP2 AUX,Then the woman who had not denied her the roasted peanuts said: ,Plural:ABS,Valenzuela (2003) ,Grammar,561,,,,
ship1254,Shipibo-Konibo,Pano-Tacanan,-yama,NEG,suffix,,,PREV,Ja-ra no-n senen-a-yama-na-ke,3:ABS-EV 1p-ERG edge-do.T-NEG-PREV-CMPL,Beware that we do not finish it (on time),PREV (preventive),Valenzuela (2003) ,Grammar,293,,,,
ship1254,Shipibo-Konibo,Pano-Tacanan,-yama,NEG,suffix,,,PST,Moan-tian nawa-baon chopa no-n bi-ama-katit-ai,Already-TEMP mestizo-PL:GEN cloth 1p-ERG get-NEG-PST4-INC,"Long time ago, we did not buy pieces of cloth in the store",,Valenzuela (2003) ,Grammar,288,347,,,
ship1254,Shipibo-Konibo,Pano-Tacanan,-yama,NEG,suffix,,,SSSA,"...joni-shoko mi-on keen-ai-bi mi-a ja-on keen-yama-kin, mi-n pe-chi waste-n nashi-xon-ti atipan-ke",Man-DIM:ABS 2-INTRSS want-SDS-EM 2-ABS 3-INTRSS want-NEG-SSSA 2-ERG BACK-BUTTOCKS piripiri-INST bathe-mMAL-INF:ABS can-CMPL,"Even if (that) little man loves you, if you don´t lve him you can bathe with the “piripiri to be left behing,” to his detriment (to get rid of him","Simultaneous event, same subject, A-orientation",Valenzuela (2003) ,Grammar,343,494,,,
ship1254,Shipibo-Konibo,Pano-Tacanan,-yama,NEG,suffix,,,SSSS,nete be-ain-tian pikó-pao-ni-ke ja-n ak-ai joni oxa oxa-yama-i,day come.n.SG-S-DS take.out:MID-HAB-REM-CMPL 3-ERG do.T.PP1 man:ABS sleep sleep-NEG-SSSS,When the day arrived the organizer came out (of his mosquito net) without sleeping much,"Simultaneous event, same subject, S-orientation",Valenzuela (2003) ,Grammar,474,,,,
ship1254,Shipibo-Konibo,Pano-Tacanan,-yama,NEG,suffix,,ASSOC,,Oro-kin-yama-wan-ka-ke,clear.chacra-ASSOC-NEG-PST1-PL-CMPL,(They) did not help (her/him) clear the chacra earlier today,,Valenzuela (2003) ,Grammar,141,,,,
ship1254,Shipibo-Konibo,Pano-Tacanan,-ma ,NEG,suffix,,ATT,,Bo-tan-we! Jawe-a-ti onan-tani-ma i-ken-bi mato-n atapa xepo-kin-ti-bires.,Carry-go.and.return-IMP what do.T-INF know-ATT-NEG be-PDS-EM 2p-GEN chicken:ABS lock-ASSOC-INF-purely,"Take him with you! Although he hardly knows how to do anything, at least he can help you lock up your chickens",,Valenzuela (2003) ,Grammar,754,,,,
ship1254,Shipibo-Konibo,Pano-Tacanan,-yama,NEG,suffix,,BEN,,Jawen ani-baon jawe-bi a-xon-yama-ke,POS3 parent-PL:ERG what:ABS-EM do.T-BEN-NEG-CMPL,Her parents did not do anything (prohibited) to her benefit ,The negative has scope over the base predicate do rather than over the applicative “predicate” -xon,Valenzuela (2003) ,Grammar,198,727-847,,,
ship1254,Shipibo-Konibo,Pano-Tacanan,-yama,NEG,suffix,,CAUS,,No-a jawe-bi maxká-ma-yama-[a]i joni,1p-ABS what:ABSEM lack-CAUS-NEG-PP1 man,a man who provides for us (lit. A man who does not leu us lack anything),,Valenzuela (2003) ,Grammar,259,261-501-800,,,
ship1254,Shipibo-Konibo,Pano-Tacanan,-ma ,NEG,suffix,,CAUS,,"Tita-n-ra chonon Biri bewa-ma-ke, i-ma-kas-kin-ma-bi",Mother-ERG-EV Chonon Biri:ABS sing-CAUS-CMPL do-CAUS-DES-SSSA-NEG-EM,Mother(j) made Chonon Biri sing agains her(j) will (lit. Without wanting to cause it) ,,Valenzuela (2003) ,Grammar,655,,,,
ship1254,Shipibo-Konibo,Pano-Tacanan,-ma ,NEG,suffix,,COMPL,,"...joni mawá-ke-tian miin-kati-kan-ai yoxan-baon ak-á maweta meran, raka-n-a-ma",person:ABS die-P-DS bury-PST4-PL-INC old.woman-PL:ERG do-T-PP2 big.jar inside lying.position-TRNZ-PP2-NEG,"..when a person died (s)he was buried in a big jar which the elderly women had made, the dead was seated straight inside the big jar, (s)he was not laid.",PP2 = Completive particle,Valenzuela (2003) ,Grammar,260,334-392,,,
ship1254,Shipibo-Konibo,Pano-Tacanan,-ma ,NEG,suffix,,DES,,"Tita-n-ra chonon Biri bewa-ma-ke, i-ma-kas-kin-ma-bi",Mother-ERG-EV Chonon Biri:ABS sing-CAUS-CMPL do-CAUS-DES-SSSA-NEG-EM,Mother(j) made Chonon Biri sing agains her(j) will (lit. Without wanting to cause it) ,,Valenzuela (2003) ,Grammar,655,,,,
ship1254,Shipibo-Konibo,Pano-Tacanan,-ma ,NEG,suffix,,DS,,Yanka-biresa e-a bachimee-ke ikon-tani i-ke-n-ma-bi.,In-vain-purely:EV 1-ABS pull.by.the.hair:MID-CMPL true-ATT be-P-DS-NEG-EM,"I was pulled by the hair unfairly, without it being true (i.e. a woman thought I was having an affair with her husband and pulled me by the hair)",,Valenzuela (2003) ,Grammar,410,,,,
ship1254,Shipibo-Konibo,Pano-Tacanan,-ma ,NEG,suffix,,INF,,"Jain ik-á iki manan keyá, tso-n-bi mapé-ti-ma",there be-PP2 AUX mountain steep who-ERG-EM climb-INF-NEG,There stood a steep mountain that nobody could climb,,Valenzuela (2003) ,Grammar,240,335-391-451,,,
ship1254,Shipibo-Konibo,Pano-Tacanan,-ma ,NEG,suffix,,INS,,Pia-n-ma-bi-ra rete-ke,Arrow-INTS-NEG-EM-EV kill-CMPL,(He) killed (it) without an/the arrow,NOUN+NEG. INTS = Instrumental,Valenzuela (2003) ,Grammar,225,,,,
ship1254,Shipibo-Konibo,Pano-Tacanan,-yama,NEG,suffix,,INTS,,E-n onan-shama-yama-ke o-ri-bo,1-ERG know-INTENS-NEG-CMPL DIST-about-PL,ABS,I don’t know those (places) well,,Valenzuela (2003) ,Grammar,367,,,
